{
  "$schema": "../../schemas/recipe.schema.json",
  "id": "seared-scallops",
  "title": "Жареные гребешки",
  "description": "Морские гребешки, обжаренные на очень горячей сковороде буквально по полминуты с каждой стороны: снаружи румяные, внутри нежные и сладковатые.",
  "category": "main",
  "diet": ["pescatarian", "gluten-free", "dairy-free"],
  "tags": ["быстро", "одна сковорода", "для гостей"],
  "difficulty": "easy",
  "servings": {
    "count": 2
  },
  "time": {
    "active": 10,
    "total": 10
  },
  "nutrition": {
    "kcal": 130,
    "protein": 25,
    "fat": 1,
    "carbs": 5
  },
  "ingredients": [
    {
      "items": [
        { "name": "Морские гребешки" },
        { "name": "Соль", "toTaste": true }
      ]
    }
  ],
  "steps": [
    {
      "steps": [
        {
          "text": "Хорошо обсушите гребешки бумажными полотенцами и посолите.",
          "tip": "Влажные гребешки не зарумянятся, а начнут тушиться в собственном соку."
        },
        {
          "text": "Разогрейте сковороду до появления лёгкого дымка."
        },
        {
          "text": "Обжарьте гребешки не дольше 30 секунд с каждой стороны.",
          "minutes": 1
        }
      ]
    }
  ],
  "seasonality": {
    "months": [1, 2, 3, 4, 5, 6, 7, 8, 9, 10, 11, 12]
  },
  "storage": {
    "fridgeDays": 1,
    "container": "Контейнер с крышкой",
    "note": "Гребешки вкуснее сразу со сковороды: при хранении они быстро становятся резиновыми."
  },
  "freezing": {
    "suitable": false,
    "note": "Готовые гребешки после заморозки становятся жёсткими и водянистыми."
  },
  "reheating": {
    "methods": [],
    "note": "Разогревать не стоит — гребешки пережарятся и станут резиновыми. Остатки лучше съесть холодными, например в салате."
  }
}
