{
  "$schema": "../../schemas/recipe.schema.json",
  "id": "spring-rolls",
  "title": "Спринг-роллы с креветками",
  "description": "Свежие вьетнамские роллы в рисовой бумаге с креветками, рисовой лапшой, хрустящими овощами, мятой и кинзой. Подаются с густым неострым арахисовым соусом — лёгкий и при этом сытный ужин без жарки.",
  "category": "main",
  "cuisine": "вьетнамская",
  "diet": ["pescatarian", "dairy-free"],
  "tags": ["для гостей", "не проверен"],
  "difficulty": "medium",
  "servings": {
    "count": 3,
    "yield": "12 роллов"
  },
  "time": {
    "active": 45,
    "total": 50
  },
  "nutrition": {
    "kcal": 570,
    "protein": 33,
    "fat": 16,
    "carbs": 73,
    "fiber": 5
  },
  "equipment": ["Кастрюля", "Широкая миска или сковорода для воды", "Разделочная доска", "Мисочки для начинки", "Влажное кухонное полотенце"],
  "ingredients": [
    {
      "title": "Роллы",
      "items": [
        { "name": "Рисовая бумага", "amount": 12, "unit": "pcs", "note": "листы ∅ 22 см" },
        { "name": "Сырые тигровые креветки", "amount": 300, "unit": "g", "note": "очищенные, ≈ 18 шт." },
        { "name": "Рисовая вермишель", "amount": 100, "unit": "g" },
        { "name": "Огурец", "amount": 1, "unit": "pcs" },
        { "name": "Морковь", "amount": 1, "unit": "pcs", "note": "крупная" },
        { "name": "Листовой салат", "amount": 6, "unit": "leaf", "note": "латук или романо" },
        { "name": "Мята", "amount": 1, "unit": "bunch" },
        { "name": "Кинза", "amount": 1, "unit": "bunch" },
        { "name": "Соль", "toTaste": true, "note": "для воды" }
      ]
    },
    {
      "title": "Арахисовый соус",
      "items": [
        { "name": "Арахисовая паста", "amount": 80, "unit": "g", "note": "pindakaas без кусочков" },
        { "name": "Соевый соус", "amount": 2, "unit": "tbsp" },
        { "name": "Сок лайма", "amount": 1, "unit": "tbsp" },
        { "name": "Мёд", "amount": 1, "unit": "tbsp", "note": "или коричневый сахар" },
        { "name": "Чеснок", "amount": 1, "unit": "clove", "note": "натереть" },
        { "name": "Кунжутное масло", "amount": 1, "unit": "tsp" },
        { "name": "Горячая вода", "amount": 60, "amountMax": 80, "unit": "ml" },
        { "name": "Жареный арахис", "amount": 20, "unit": "g", "optional": true, "note": "порубить, для подачи" },
        { "name": "Шрирача или хлопья чили", "optional": true, "note": "Света не ест острое — подавайте отдельно" }
      ]
    }
  ],
  "steps": [
    {
      "title": "Начинка",
      "steps": [
        {
          "text": "Опустите креветки в кипящую подсоленную воду и варите, пока они не порозовеют.",
          "minutes": 2,
          "tip": "Креветки готовы, когда свернулись в букву «С»; свёрнутые в кольцо — уже переварены и жёсткие."
        },
        {
          "text": "Переложите креветки в холодную воду, обсушите и разрежьте каждую вдоль пополам."
        },
        {
          "text": "Сварите или замочите рисовую вермишель по инструкции на упаковке, промойте холодной водой и хорошо откиньте на сито.",
          "minutes": 5,
          "tip": "Лапша должна быть сухой: лишняя вода размочит бумагу. Длинную лапшу укоротите ножницами."
        },
        {
          "text": "Нарежьте огурец и морковь тонкой соломкой, салат — полосками шириной 2–3 см. Оборвите листья мяты и кинзы. Разложите всё по мисочкам.",
          "minutes": 10
        }
      ]
    },
    {
      "title": "Соус",
      "steps": [
        {
          "text": "Смешайте арахисовую пасту, соевый соус, сок лайма, мёд, чеснок и кунжутное масло.",
          "minutes": 3
        },
        {
          "text": "Разбавляйте горячей водой по ложке, размешивая, до консистенции густых сливок.",
          "tip": "Соус густеет, остывая: перед подачей можно добавить ещё ложку воды."
        }
      ]
    },
    {
      "title": "Сборка",
      "steps": [
        {
          "text": "Налейте в широкую миску тёплую воду. Окуните лист рисовой бумаги на 5–10 секунд и положите на влажную доску.",
          "tip": "Бумага продолжает размягчаться на доске: доставайте её ещё чуть упругой, иначе она порвётся."
        },
        {
          "text": "На нижнюю треть листа положите кусочек салата, немного лапши, огурца, моркови, мяты и кинзы. Не перекладывайте начинку."
        },
        {
          "text": "Сверните один оборот, плотно прижимая начинку. Выложите в ряд 3 половинки креветок разрезом вверх, загните боковые края и сверните ролл до конца.",
          "tip": "Креветки, выложенные после первого оборота, будут красиво просвечивать сквозь бумагу."
        },
        {
          "text": "Повторите с остальными листами. Готовые роллы держите под влажным полотенцем, не давая им касаться друг друга.",
          "minutes": 20
        },
        {
          "text": "Подавайте сразу с арахисовым соусом, посыпав его рубленым арахисом."
        }
      ]
    }
  ],
  "tips": [
    "Рисовая бумага (rijstvellen) и рисовая вермишель есть в AH в разделе азиатских продуктов и в азиатских магазинах.",
    "Роллы, касаясь друг друга, слипаются и рвутся — раскладывайте их с промежутком или заворачивайте каждый в пищевую плёнку.",
    "Света не ест острое: шрирачу или чили подавайте в отдельной мисочке.",
    "Вместо креветок подойдёт отварная курица или обжаренный тофу; в начинку хорошо добавить сладкий перец, авокадо или манго. Для без глютена замените соевый соус на тамари."
  ],
  "seasonality": {
    "months": [1, 2, 3, 4, 5, 6, 7, 8, 9, 10, 11, 12],
    "note": "Продукты есть круглый год; летом, со свежей мятой и огурцами, роллы особенно хороши."
  },
  "storage": {
    "fridgeDays": 1,
    "container": "Каждый ролл в пищевой плёнке",
    "note": "Рисовая бумага в холодильнике твердеет — достаньте роллы за 20–30 минут до еды. Соус храните отдельно в банке до 5 дней."
  },
  "freezing": {
    "suitable": false,
    "note": "Рисовая бумага и свежие овощи после разморозки раскисают."
  },
  "reheating": {
    "methods": [],
    "note": "Подают холодными или комнатной температуры."
  }
}
