{
  "$schema": "../../schemas/recipe.schema.json",
  "id": "olivier",
  "title": "Оливье",
  "description": "Праздничный салат из отварных картофеля, моркови и яиц с колбасой, солёными огурцами и зелёным горошком под майонезом. Большая миска на компанию.",
  "category": "salad",
  "cuisine": "русская",
  "tags": ["праздник", "для гостей"],
  "difficulty": "medium",
  "servings": {
    "count": 8,
    "yield": "≈ 2,2 кг"
  },
  "time": {
    "active": 40,
    "total": 70
  },
  "nutrition": {
    "kcal": 460,
    "protein": 17,
    "fat": 37,
    "carbs": 15,
    "fiber": 3
  },
  "ingredients": [
    {
      "items": [
        { "name": "Колбаса или мясо", "amount": 500, "unit": "g", "note": "варёная колбаса или готовое отварное мясо" },
        { "name": "Картофель", "amount": 400, "unit": "g" },
        { "name": "Морковь", "amount": 200, "unit": "g" },
        { "name": "Зелёный горошек", "amount": 300, "unit": "g" },
        { "name": "Яйца", "amount": 6, "unit": "pcs", "note": "≈ 400 г" },
        { "name": "Солёные огурцы", "amount": 200, "unit": "g" },
        { "name": "Майонез", "amount": 200, "unit": "g" }
      ]
    }
  ],
  "steps": [
    {
      "steps": [
        {
          "text": "Очистите картофель, нарежьте кубиками и отварите — аккуратно, не переваривая. Откиньте на дуршлаг и промойте холодной водой.",
          "minutes": 10,
          "tip": "Кубики должны стать мягкими, но не развариться: переваренный картофель в салате превратится в пюре."
        },
        {
          "text": "Так же очистите, нарежьте кубиками и отварите морковь, затем промойте холодной водой.",
          "minutes": 10
        },
        {
          "text": "Отварите яйца вкрутую, остудите в холодной воде и очистите.",
          "minutes": 10
        },
        {
          "text": "Нарежьте кубиками колбасу или мясо, яйца и солёные огурцы. Соедините с картофелем, морковью и горошком (консервированный — без жидкости) и перемешайте с майонезом."
        }
      ]
    }
  ],
  "tips": [
    "Если удобнее отмерять на глаз, соотношение нарезанных продуктов по объёму такое: колбаса — 1 часть, картофель — 1,5, морковь — 0,5, горошек — 0,5, яйца — 0,5, солёные огурцы — 1, плюс майонез."
  ],
  "seasonality": {
    "months": [1, 2, 3, 4, 5, 6, 7, 8, 9, 10, 11, 12]
  },
  "storage": {
    "fridgeDays": 1,
    "container": "Миска или контейнер с крышкой",
    "note": "Салат с майонезом храните в холодильнике не дольше суток. Нарезанные продукты без майонеза хранятся до 2 дней — заправляйте перед подачей."
  },
  "freezing": {
    "suitable": false,
    "note": "Майонез после заморозки расслаивается, а отварные овощи и яйца становятся водянистыми и резиновыми."
  },
  "reheating": {
    "methods": [],
    "note": "Подаётся холодным."
  }
}
