{
  "$schema": "../../schemas/recipe.schema.json",
  "id": "cabbage-pizza",
  "title": "Пицца с капустой и колбасками",
  "description": "Белая пицца без томатного соуса: тушёная савойская капуста с луком, обжаренные колбаски сальсичча, моцарелла и пармезан на толстом пышном тесте. Сытная осенне-зимняя пицца в духе северной Италии.",
  "category": "main",
  "cuisine": "итальянская",
  "tags": ["дрожжевое тесто", "духовка", "не проверен"],
  "difficulty": "medium",
  "servings": {
    "count": 2,
    "yield": "1 пицца ≈ 30 см"
  },
  "time": {
    "active": 50,
    "total": 205,
    "note": "или сутки в холодильнике — вариант в советах"
  },
  "nutrition": {
    "kcal": 1000,
    "protein": 42,
    "fat": 46,
    "carbs": 101,
    "fiber": 7
  },
  "equipment": ["Кухонные весы", "Миска для замеса или планетарный миксер", "Контейнер для теста или миска с крышкой", "Сотейник Ø 28 см с крышкой", "Противень и пергамент", "Тёрка", "Нож для пиццы"],
  "ingredients": [
    {
      "title": "Тесто (на 1 пиццу)",
      "items": [
        { "name": "Пшеничная мука", "amount": 250, "unit": "g", "note": "тип 00 или обычная (tarwebloem); и немного для подсыпки" },
        { "name": "Тёплая вода", "amount": 165, "unit": "ml", "note": "около 30 °C" },
        { "name": "Сухие дрожжи", "amount": 2, "unit": "g", "note": "или 6 г живых" },
        { "name": "Соль", "amount": 6, "unit": "g" },
        { "name": "Оливковое масло", "amount": 10, "unit": "g", "note": "и немного для миски" }
      ]
    },
    {
      "title": "Начинка",
      "items": [
        { "name": "Колбаски сальсичча", "amount": 150, "unit": "g", "note": "≈ 2 шт.; свежие свиные" },
        { "name": "Репчатый лук", "amount": 1, "unit": "pcs", "note": "≈ 100 г; нарезать полукольцами" },
        { "name": "Савойская капуста", "amount": 250, "unit": "g", "note": "≈ ¼ кочана; тонко нашинковать" },
        { "name": "Вода", "amount": 50, "unit": "ml" },
        { "name": "Семена фенхеля", "amount": 0.5, "unit": "tsp", "optional": true, "note": "если их нет в колбасках" },
        { "name": "Соль", "toTaste": true },
        { "name": "Чёрный перец", "toTaste": true }
      ]
    },
    {
      "title": "Сборка",
      "items": [
        { "name": "Оливковое масло", "amount": 1, "unit": "tbsp" },
        { "name": "Чеснок", "amount": 1, "unit": "clove", "note": "натереть" },
        { "name": "Моцарелла для пиццы", "amount": 100, "unit": "g", "note": "в брикете; натереть на крупной тёрке" },
        { "name": "Пармезан", "amount": 20, "unit": "g", "note": "натереть" },
        { "name": "Хлопья чили", "amount": 1, "unit": "pinch", "optional": true, "note": "Света не ест острое" }
      ]
    }
  ],
  "steps": [
    {
      "title": "Тесто",
      "steps": [
        {
          "text": "Растворите дрожжи в тёплой воде, всыпьте муку и перемешайте до однородности. Добавьте соль и масло.",
          "minutes": 3,
          "tip": "Соль добавляйте после муки, чтобы она не попала прямо на дрожжи."
        },
        {
          "text": "Месите руками 10 минут или миксером с крюком 7 минут на низкой скорости, пока тесто не станет гладким и упругим.",
          "minutes": 10,
          "tip": "Тесто влажнее, чем у «Маргариты» (около 65 % воды), и слегка липнет — так и надо. Не забивайте его мукой: смажьте руки маслом или работайте скребком."
        },
        {
          "text": "Скатайте тесто в шар, положите в смазанную маслом миску, накройте и оставьте в тёплом месте, пока оно не увеличится вдвое.",
          "minutes": 120
        },
        {
          "text": "Выложите тесто на присыпанный мукой стол, сформируйте тугой шар и оставьте ещё на 45 минут в контейнере для теста или под перевёрнутой миской.",
          "minutes": 45,
          "tip": "Тесто готово, если ямка от пальца медленно выравнивается, а не исчезает сразу."
        }
      ]
    },
    {
      "title": "Начинка",
      "steps": [
        {
          "text": "Пока шар подходит, снимите с колбасок оболочку и разомните фарш. Обжарьте его в сотейнике без масла на среднем огне, разбивая на кусочки, до румяной корочки, и переложите в миску.",
          "minutes": 7,
          "tip": "Колбаски жирные — масло не нужно. Вытопившийся жир оставьте в сотейнике: на нём жарится лук."
        },
        {
          "text": "Обжарьте лук на вытопившемся жире до мягкости.",
          "minutes": 5
        },
        {
          "text": "Добавьте капусту и фенхель, посолите, перемешайте и влейте воду. Тушите под крышкой на среднем огне, пока капуста не станет мягкой.",
          "minutes": 10
        },
        {
          "text": "Снимите крышку и выпарите всю жидкость. Поперчите, смешайте с колбасками и дайте остыть.",
          "minutes": 3,
          "tip": "Начинка должна быть сухой и не горячей: мокрая капуста размочит тесто, и пицца не пропечётся."
        },
        {
          "text": "Смешайте оливковое масло с тёртым чесноком."
        }
      ]
    },
    {
      "title": "Сборка и выпечка",
      "steps": [
        {
          "text": "За 30 минут до выпечки разогрейте духовку до 250 °C (или до максимума) в режиме «верх-низ», решётку поставьте на нижний уровень."
        },
        {
          "text": "Положите шар на присыпанный мукой пергамент и растяните пальцами от центра в круг около 30 см, оставив по краю нетронутый бортик 2–3 см. Переложите пергамент на противень.",
          "minutes": 4,
          "tip": "Не раскатывайте скалкой и не приминайте край: в бортике остаются пузырьки воздуха, и он поднимается пышным."
        },
        {
          "text": "Смажьте тесто чесночным маслом, не заходя на бортик. Посыпьте половиной моцареллы, выложите капусту с колбасками, сверху — остаток моцареллы и пармезан.",
          "minutes": 3
        },
        {
          "text": "Выпекайте на нижнем уровне, пока бортик не станет золотистым, а сыр не расплавится и не подрумянится.",
          "minutes": 14,
          "tip": "Начинка тяжелее, чем у «Маргариты», и тесто толще — пицца печётся 12–15 минут. Приподнимите край лопаткой: низ должен быть румяным, а не бледным."
        },
        {
          "text": "Дайте пицце постоять 2 минуты и нарежьте. Чили посыпьте только свои куски.",
          "minutes": 2
        }
      ]
    }
  ],
  "tips": [
    "Тесто — то же, что у пиццы пепперони: толще, чем у «Маргариты», по заметке владельца «сделать тесто толстым». 250 г муки и около 65 % воды на одну пиццу, бортик не приминается.",
    "Сальсиччу ищите в Sligro или в мясном отделе (Italiaanse worst, salsiccia). Подойдут любые свежие сырые свиные колбаски — тогда обязательно добавьте фенхель.",
    "Хлопья чили — только на свою половину: Света не ест острое.",
    "Расстойка на сутки: возьмите 1 г сухих дрожжей, после замеса уберите тесто в контейнер в холодильник на 24 часа, затем сформируйте шар и дайте ему согреться 2 часа при комнатной температуре."
  ],
  "seasonality": {
    "months": [9, 10, 11, 12, 1, 2, 3, 4],
    "note": "Савойская капуста — с сентября по апрель. Летом замените её остроконечной (spitskool): она нежнее, тушите 5 минут."
  },
  "storage": {
    "fridgeDays": 2,
    "container": "Контейнер или плотно завернуть в фольгу",
    "note": "Вкуснее всего сразу из духовки: при хранении корж размягчается. Остудите и уберите в холодильник не позже чем через 2 часа."
  },
  "freezing": {
    "suitable": true,
    "months": 2,
    "how": "Удобнее морозить тесто: шар после первого подъёма смазать маслом и убрать в zip-пакет. Готовую пиццу — остудить, разрезать на куски и завернуть в плёнку и фольгу.",
    "thawing": "Тесто — ночь в холодильнике и 2 часа при комнатной температуре перед формовкой. Готовую пиццу — без разморозки в духовку на 200 °C."
  },
  "reheating": {
    "methods": [
      {
        "method": "oven",
        "instructions": "220 °C на нижнем уровне, на решётке или противне.",
        "minutes": 7
      },
      {
        "method": "stovetop",
        "instructions": "На сухой сковороде под крышкой на среднем огне — низ снова станет хрустящим.",
        "minutes": 5
      }
    ]
  }
}
