{
  "$schema": "../../schemas/recipe.schema.json",
  "id": "chakhokhbili",
  "title": "Чахохбили",
  "description": "Куриные бёдра, тушённые с луком, помидорами и томатной пастой, с кинзой, чесноком и уцхо-сунели в конце. Густой томатный соус хорош с хлебом.",
  "category": "main",
  "cuisine": "грузинская",
  "diet": ["gluten-free", "dairy-free"],
  "tags": ["одна сковорода", "на заморозку"],
  "difficulty": "medium",
  "servings": {
    "count": 3
  },
  "time": {
    "active": 30,
    "total": 70
  },
  "nutrition": {
    "kcal": 485,
    "protein": 33,
    "fat": 35,
    "carbs": 11,
    "fiber": 2
  },
  "equipment": ["Глубокая сковорода или сотейник с крышкой"],
  "ingredients": [
    {
      "items": [
        { "name": "Репчатый лук", "amount": 1, "unit": "pcs" },
        { "name": "Куриные бёдра", "amount": 0.7, "unit": "kg" },
        { "name": "Помидоры", "amount": 2, "unit": "pcs", "note": "можно консервированные" },
        { "name": "Томатная паста", "amount": 2, "unit": "tbsp" },
        { "name": "Кинза", "amount": 10, "amountMax": 20, "unit": "g" },
        { "name": "Фиолетовый базилик", "optional": true },
        { "name": "Чеснок", "amount": 2, "amountMax": 3, "unit": "clove" },
        { "name": "Уцхо-сунели", "toTaste": true },
        { "name": "Соль", "toTaste": true },
        { "name": "Сахар", "toTaste": true },
        { "name": "Растительное масло", "toTaste": true, "note": "для жарки" }
      ]
    }
  ],
  "steps": [
    {
      "steps": [
        {
          "text": "Нарежьте лук и обжарьте его."
        },
        {
          "text": "Нарежьте куриные бёдра, выложите к луку и слегка обжарьте, затем выньте."
        },
        {
          "text": "Нарежьте помидоры, выложите на лук и добавьте томатную пасту.",
          "tip": "Консервированные помидоры можно предварительно измельчить блендером."
        },
        {
          "text": "Верните курицу, всё перемешайте и залейте водой так, чтобы она покрывала содержимое."
        },
        {
          "text": "Посолите, добавьте сахар и тушите 25–30 минут.",
          "minutes": 25
        },
        {
          "text": "Порубите чеснок и кинзу. Добавьте их в сковороду вместе с уцхо-сунели и, по желанию, фиолетовым базиликом."
        },
        {
          "text": "Снимите с плиты и дайте настояться 10 минут.",
          "minutes": 10
        }
      ]
    }
  ],
  "tips": [
    "Шаг с заливкой водой автор сам пометил как сомнительный («как-то бредово») — его ещё стоит перепроверить."
  ],
  "seasonality": {
    "months": [1, 2, 3, 4, 5, 6, 7, 8, 9, 10, 11, 12],
    "note": "Летом и осенью — со спелыми грунтовыми помидорами, в остальное время — с консервированными."
  },
  "storage": {
    "fridgeDays": 3,
    "container": "Контейнер с крышкой",
    "note": "Остудите и уберите в холодильник не позже чем через 2 часа."
  },
  "freezing": {
    "suitable": true,
    "months": 3,
    "how": "Остудить и разложить по контейнерам вместе с соусом, оставив 1–2 см до крышки.",
    "thawing": "Ночь в холодильнике, затем прогреть на плите под крышкой."
  },
  "reheating": {
    "methods": [
      {
        "method": "stovetop",
        "instructions": "В сотейнике под крышкой на слабом огне, добавив немного воды.",
        "minutes": 10
      },
      {
        "method": "microwave",
        "instructions": "Под крышкой, перемешав на середине.",
        "minutes": 4
      }
    ]
  }
}
