{
  "$schema": "../../schemas/recipe.schema.json",
  "id": "cottage-cheese-casserole",
  "title": "Творожная запеканка с адыгейским сыром",
  "description": "Творожная запеканка с адыгейским сыром и манкой, без муки. Масса собирается за четверть часа, ещё полчаса — в духовке.",
  "category": "breakfast",
  "cuisine": "русская",
  "diet": ["vegetarian"],
  "tags": ["духовка", "на заморозку"],
  "difficulty": "medium",
  "servings": {
    "count": 4
  },
  "time": {
    "active": 20,
    "total": 55
  },
  "nutrition": {
    "kcal": 305,
    "protein": 27,
    "fat": 13,
    "carbs": 20
  },
  "equipment": ["Духовка", "Форма для запекания"],
  "ingredients": [
    {
      "title": "Запеканка",
      "items": [
        { "name": "Молоко", "amount": 50, "unit": "ml", "note": "горячее" },
        { "name": "Манка", "amount": 3, "unit": "tbsp", "note": "без горки" },
        { "name": "Творог", "amount": 400, "unit": "g" },
        { "name": "Адыгейский сыр", "amount": 150, "unit": "g" },
        { "name": "Яйцо", "amount": 1, "unit": "pcs" },
        { "name": "Крахмал", "amount": 1, "unit": "tbsp" },
        { "name": "Разрыхлитель", "amount": 5, "unit": "g" },
        { "name": "Сахар", "amount": 2, "unit": "tbsp" },
        { "name": "Соль", "amount": 0.5, "unit": "tsp" },
        { "name": "Ванилин", "toTaste": true }
      ]
    },
    {
      "title": "Для формы",
      "items": [
        { "name": "Сливочное масло", "note": "для смазывания" },
        { "name": "Манка", "note": "для обсыпки" }
      ]
    }
  ],
  "steps": [
    {
      "steps": [
        {
          "text": "Залейте манку горячим молоком и оставьте набухать."
        },
        {
          "text": "Разомните творог до однородности — в блендере, толкушкой или протерев через сито. Можно сразу купить мягкий размятый творог.",
          "minutes": 5
        },
        {
          "text": "Добавьте к творогу адыгейский сыр и тоже разомните."
        },
        {
          "text": "Добавьте манку с молоком, яйцо, крахмал, разрыхлитель, сахар, соль и ванилин и перемешайте."
        },
        {
          "text": "Смажьте форму или противень сливочным маслом, обсыпьте манкой и выложите массу."
        },
        {
          "text": "Выпекайте в разогретой до 180 °C духовке 30 минут.",
          "minutes": 30
        }
      ]
    }
  ],
  "tips": [
    "Свете не готовить: подгорает, корка получается резиновой."
  ],
  "seasonality": {
    "months": [1, 2, 3, 4, 5, 6, 7, 8, 9, 10, 11, 12]
  },
  "storage": {
    "fridgeDays": 3,
    "container": "Контейнер с крышкой или форма под плёнкой",
    "note": "Остудите полностью и уберите в холодильник не позже чем через 2 часа после выпечки."
  },
  "freezing": {
    "suitable": true,
    "months": 2,
    "how": "Остудить, нарезать порциями, завернуть каждую в плёнку и сложить в пакет или контейнер.",
    "thawing": "Ночь в холодильнике, затем разогреть."
  },
  "reheating": {
    "methods": [
      {
        "method": "microwave",
        "instructions": "Порцию на тарелке, накрыв, на полной мощности.",
        "minutes": 1.5
      },
      {
        "method": "oven",
        "instructions": "160 °C, накрыв фольгой, чтобы верх не пересох.",
        "minutes": 10
      }
    ]
  }
}
