{
  "$schema": "../../schemas/recipe.schema.json",
  "id": "lemon-garlic-chicken-thighs",
  "title": "Куриные бёдра с лимоном и чесноком",
  "description": "Бёдра с хрустящей кожей, запечённые на одном противне с картофелем, чесноком и розмарином. Курица отдаёт сок картофелю, а запечённый лимон в конце делает вкус ярким.",
  "category": "main",
  "cuisine": "средиземноморская",
  "diet": ["gluten-free", "dairy-free"],
  "tags": ["один противень", "на неделю", "для гостей"],
  "difficulty": "easy",
  "servings": {
    "count": 4
  },
  "time": {
    "active": 15,
    "total": 65,
    "note": "+ от 1 часа маринования, если есть время"
  },
  "nutrition": {
    "kcal": 670,
    "protein": 42,
    "fat": 39,
    "carbs": 37,
    "fiber": 4
  },
  "equipment": ["Большой противень с бортиками", "Кухонный термометр (по желанию)"],
  "ingredients": [
    {
      "items": [
        { "name": "Куриные бёдра на кости с кожей", "amount": 8, "unit": "pcs", "note": "≈ 1,2 кг" },
        { "name": "Мелкий картофель", "amount": 800, "unit": "g" },
        { "name": "Лимон", "amount": 1, "unit": "pcs" },
        { "name": "Чеснок", "amount": 10, "unit": "clove", "note": "≈ 1 головка, не чистить" },
        { "name": "Оливковое масло", "amount": 3, "unit": "tbsp" },
        { "name": "Розмарин или тимьян", "amount": 4, "unit": "sprig" },
        { "name": "Копчёная паприка", "amount": 1, "unit": "tsp" },
        { "name": "Соль", "amount": 2, "unit": "tsp" },
        { "name": "Чёрный перец", "toTaste": true }
      ]
    }
  ],
  "steps": [
    {
      "steps": [
        {
          "text": "Обсушите бёдра бумажным полотенцем и натрите 1 ч. л. соли, паприкой и перцем. Если есть время, оставьте в холодильнике без плёнки от часа до ночи.",
          "minutes": 5,
          "tip": "Подсушенная и заранее посоленная кожа хрустит лучше всего. Перед запеканием достаньте курицу из холодильника за 20 минут."
        },
        {
          "text": "Разогрейте духовку до 220 °C. Разрежьте картофель пополам, зубчики чеснока слегка раздавите, не очищая.",
          "minutes": 5
        },
        {
          "text": "Прямо на противне перемешайте картофель с маслом, оставшейся солью, чесноком и травами. Разложите в один слой срезом вниз.",
          "minutes": 3
        },
        {
          "text": "Выложите бёдра поверх картофеля кожей вверх, между ними — кружки лимона.",
          "minutes": 2,
          "tip": "Кожа должна оставаться сухой и открытой — не поливайте её маслом с противня."
        },
        {
          "text": "Запекайте 40–45 минут, пока кожа не станет хрустящей, а у кости не будет 75 °C.",
          "minutes": 43,
          "tip": "Без термометра: проколите бедро у кости — сок должен быть прозрачным, без розового оттенка."
        },
        {
          "text": "Дайте курице отдохнуть 5 минут. Выдавите запечённый лимон и мягкий чеснок из шелухи на картофель и перемешайте его с соком на противне.",
          "minutes": 5
        }
      ]
    }
  ],
  "tips": [
    "Бёдра можно заменить голенями — время то же. Филе без кожи в этом рецепте пересыхает.",
    "Крупный картофель режьте на четвертинки, чтобы он пропёкся одновременно с курицей.",
    "Подавайте с зелёным салатом или соусом из йогурта с огурцом — тогда блюдо уже не безмолочное."
  ],
  "seasonality": {
    "months": [1, 2, 3, 4, 5, 6, 7, 8, 9, 10, 11, 12],
    "note": "Весной и летом берите молодой картофель — его не нужно чистить, а запекается он быстрее."
  },
  "storage": {
    "fridgeDays": 4,
    "container": "Контейнер с крышкой"
  },
  "freezing": {
    "suitable": true,
    "months": 3,
    "how": "Замораживать только бёдра, без картофеля — он после заморозки становится водянистым. Остудить, завернуть по 1–2 шт. в фольгу и убрать в пакет.",
    "thawing": "Ночь в холодильнике, затем разогреть в духовке."
  },
  "reheating": {
    "methods": [
      {
        "method": "oven",
        "instructions": "180 °C на противне без фольги, 12–15 минут — кожа снова захрустит.",
        "minutes": 13
      },
      {
        "method": "airfryer",
        "instructions": "180 °C в один слой, 6–8 минут.",
        "minutes": 7
      },
      {
        "method": "microwave",
        "instructions": "Под крышкой, перевернув на середине. Быстро, но кожа станет мягкой.",
        "minutes": 3
      }
    ]
  }
}
