{
  "$schema": "../../schemas/recipe.schema.json",
  "id": "ramen",
  "title": "Рамен с говядиной",
  "description": "Домашний рамен на долго сваренном говяжьем бульоне с соевым соусом, кунжутом и овощной соломкой. В миске — лапша, бульон, мясо и варёное яйцо.",
  "category": "soup",
  "cuisine": "японская",
  "diet": ["dairy-free"],
  "tags": ["на неделю"],
  "difficulty": "medium",
  "servings": {
    "count": 4
  },
  "time": {
    "active": 35,
    "total": 160,
    "note": "бульон можно варить и дольше — будет только вкуснее"
  },
  "nutrition": {
    "kcal": 580,
    "protein": 35,
    "fat": 18,
    "carbs": 70,
    "fiber": 3
  },
  "equipment": ["Кастрюля", "Сито"],
  "ingredients": [
    {
      "title": "Бульон",
      "items": [
        { "name": "Вода", "amount": 2, "unit": "l" },
        { "name": "Говядина", "amount": 300, "amountMax": 400, "unit": "g" },
        { "name": "Репчатый лук", "amount": 1, "unit": "pcs" },
        { "name": "Морковь", "amount": 1, "unit": "pcs" }
      ]
    },
    {
      "title": "Суп",
      "items": [
        { "name": "Репчатый лук", "amount": 1, "unit": "pcs", "note": "соломкой" },
        { "name": "Морковь", "amount": 1, "unit": "pcs", "note": "соломкой" },
        { "name": "Соевый соус", "amount": 50, "unit": "ml" },
        { "name": "Сахар", "amount": 10, "unit": "g" },
        { "name": "Кунжут", "toTaste": true }
      ]
    },
    {
      "title": "Для подачи",
      "items": [
        { "name": "Лапша" },
        { "name": "Яйца", "amount": 4, "unit": "pcs", "note": "по одному на порцию" },
        { "name": "Кунжутное масло", "optional": true },
        { "name": "Кинза", "optional": true }
      ]
    }
  ],
  "steps": [
    {
      "title": "Бульон",
      "steps": [
        {
          "text": "Залейте говядину водой и сварите бульон на слабом огне: чем дольше он варится, тем лучше.",
          "minutes": 60
        },
        {
          "text": "За час до готовности добавьте в бульон одну луковицу и одну морковь.",
          "minutes": 60
        },
        {
          "text": "Процедите бульон и верните его в кастрюлю. Мясо нарежьте для подачи.",
          "minutes": 5
        }
      ]
    },
    {
      "title": "Суп",
      "steps": [
        {
          "text": "Нарежьте соломкой вторую луковицу и морковь, положите в бульон и варите 10 минут.",
          "minutes": 10
        },
        {
          "text": "Добавьте соевый соус и сахар, посыпьте кунжутом и варите ещё 5 минут.",
          "minutes": 5
        }
      ]
    },
    {
      "title": "Подача",
      "steps": [
        {
          "text": "Сварите яйца — по одному на порцию — и очистите.",
          "minutes": 8,
          "tip": "6–7 минут в кипящей воде — желток останется жидким, 9–10 минут — яйцо будет крутым."
        },
        {
          "text": "Сварите лапшу по инструкции на упаковке.",
          "minutes": 5
        },
        {
          "text": "Соберите миску: лапша, горячий бульон, мясо и яйцо. По желанию добавьте несколько капель кунжутного масла и кинзу.",
          "minutes": 3
        }
      ]
    }
  ],
  "seasonality": {
    "months": [1, 2, 3, 4, 5, 6, 7, 8, 9, 10, 11, 12]
  },
  "storage": {
    "fridgeDays": 3,
    "container": "Кастрюля с крышкой или контейнеры",
    "note": "Бульон с мясом храните отдельно от лапши и яиц, лапшу варите к подаче. Остудите и уберите в холодильник не позже чем через 2 часа."
  },
  "freezing": {
    "suitable": true,
    "months": 3,
    "how": "Заморозить бульон с мясом и овощами без лапши и яиц: остудить, разлить по контейнерам, оставив 2 см до крышки.",
    "thawing": "Ночь в холодильнике или сразу в кастрюлю на слабый огонь под крышкой. Лапшу и яйца — свежие."
  },
  "reheating": {
    "methods": [
      {
        "method": "stovetop",
        "instructions": "Бульон с мясом — в кастрюлю на средний огонь, довести до кипения. Лапшу и яйцо положить в миску и залить горячим бульоном.",
        "minutes": 7
      },
      {
        "method": "microwave",
        "instructions": "Бульон с мясом — в глубокой миске под крышкой на полной мощности.",
        "minutes": 3
      }
    ]
  }
}
