{
  "$schema": "../../schemas/recipe.schema.json",
  "id": "english-mushroom-soup",
  "title": "Грибной крем-суп с гренками",
  "description": "Английский грибной суп из каштановых шампиньонов с тимьяном на бульоне, загущённый ложкой муки и смягчённый сливками. Пюрируется не до конца, а к нему — самодельные хрустящие гренки из духовки.",
  "category": "soup",
  "cuisine": "английская",
  "diet": ["vegetarian"],
  "tags": ["на заморозку", "одна кастрюля", "духовка", "не проверен"],
  "difficulty": "easy",
  "servings": {
    "count": 4,
    "yield": "≈ 1,6 л"
  },
  "time": {
    "active": 35,
    "total": 50
  },
  "nutrition": {
    "kcal": 370,
    "protein": 9,
    "fat": 24,
    "carbs": 30,
    "fiber": 3
  },
  "equipment": ["Кастрюля 3 л с крышкой", "Погружной блендер", "Духовка", "Противень с пергаментом"],
  "ingredients": [
    {
      "title": "Суп",
      "items": [
        { "name": "Сливочное масло", "amount": 30, "unit": "g" },
        { "name": "Репчатый лук", "amount": 1, "unit": "pcs", "note": "крупный; мелко нарезать" },
        { "name": "Чеснок", "amount": 2, "unit": "clove", "note": "мелко нарезать" },
        { "name": "Каштановые шампиньоны", "amount": 600, "unit": "g", "note": "kastanjechampignons; можно наполовину с белыми шампиньонами" },
        { "name": "Свежий тимьян", "amount": 4, "unit": "sprig", "note": "листики; или ½ ч. л. сушёного" },
        { "name": "Пшеничная мука", "amount": 20, "unit": "g" },
        { "name": "Овощной бульон", "amount": 800, "unit": "ml", "note": "горячий; можно куриный" },
        { "name": "Сливки 30–35 %", "amount": 120, "unit": "ml", "note": "slagroom" },
        { "name": "Соль", "toTaste": true },
        { "name": "Чёрный перец", "toTaste": true },
        { "name": "Петрушка", "toTaste": true, "optional": true, "note": "для подачи" }
      ]
    },
    {
      "title": "Гренки",
      "items": [
        { "name": "Хлеб", "amount": 120, "unit": "g", "note": "вчерашний белый или sourdough, 3–4 ломтя" },
        { "name": "Оливковое масло", "amount": 2, "unit": "tbsp" },
        { "name": "Сушёный тимьян", "amount": 1, "unit": "pinch" },
        { "name": "Соль", "amount": 1, "unit": "pinch" }
      ]
    }
  ],
  "steps": [
    {
      "title": "Суп",
      "steps": [
        {
          "text": "Растопите сливочное масло в кастрюле и обжарьте лук на среднем огне до мягкости, не давая ему потемнеть.",
          "minutes": 8
        },
        {
          "text": "Добавьте чеснок и листики тимьяна и прогрейте, помешивая.",
          "minutes": 1
        },
        {
          "text": "Добавьте нарезанные грибы, прибавьте огонь и жарьте без крышки, пока они не пустят сок и он почти не выпарится.",
          "minutes": 10,
          "tip": "Не накрывайте крышкой: выпаренный сок и лёгкая обжарка дают супу главный грибной вкус."
        },
        {
          "text": "Посыпьте грибы мукой, перемешайте и прогрейте 1–2 минуты, чтобы ушёл мучной привкус.",
          "minutes": 2
        },
        {
          "text": "Влейте горячий бульон постепенно, помешивая, доведите до кипения, накройте крышкой и варите на слабом огне 15 минут.",
          "minutes": 15
        },
        {
          "text": "Пюрируйте суп погружным блендером не до конца — в густой основе должны остаться кусочки грибов.",
          "minutes": 2,
          "tip": "Если варите впрок, заморозьте суп на этом этапе, до сливок: так он отлично переносит заморозку."
        },
        {
          "text": "Влейте сливки и прогрейте, не доводя до кипения. Посолите и поперчите.",
          "minutes": 3
        }
      ]
    },
    {
      "title": "Гренки",
      "steps": [
        {
          "text": "Пока суп варится, разогрейте духовку до 180 °C."
        },
        {
          "text": "Нарежьте хлеб кубиками 1,5–2 см и перемешайте в миске с оливковым маслом, тимьяном и солью."
        },
        {
          "text": "Выложите кубики в один слой на противень с пергаментом и запекайте до золотистого цвета, перемешав на середине.",
          "minutes": 12,
          "tip": "Гренки досыхают, остывая: если в середине они ещё чуть мягкие, через 5 минут станут хрустящими."
        },
        {
          "text": "Разлейте суп по тарелкам, сверху положите гренки и посыпьте петрушкой."
        }
      ]
    }
  ],
  "tips": [
    "Не пюрируйте суп до конца: кусочки грибов должны остаться.",
    "Покупные сухарики (Кнорр) к грибному супу не очень — самодельные гренки из вчерашнего хлеба получаются заметно вкуснее, а готовятся, пока варится суп.",
    "Суп отлично замораживается без сливок: сливки добавьте уже при разогреве после разморозки.",
    "Для более глубокого вкуса замочите 10 г сушёных белых грибов в 100 мл кипятка, добавьте их к шампиньонам, а настой процедите в бульон."
  ],
  "seasonality": {
    "months": [1, 2, 3, 4, 5, 6, 7, 8, 9, 10, 11, 12],
    "note": "Шампиньоны продаются круглый год. Осенью часть шампиньонов можно заменить лесными грибами."
  },
  "storage": {
    "fridgeDays": 2,
    "container": "Кастрюля с крышкой или контейнеры",
    "note": "Суп без сливок хранится 3 дня. Гренки держите отдельно в закрытой банке при комнатной температуре до 4 дней."
  },
  "freezing": {
    "suitable": true,
    "months": 3,
    "how": "Замораживать без сливок: остудить пюрированную основу, разлить по контейнерам, оставив 2 см до крышки. Гренки не замораживать.",
    "thawing": "Ночь в холодильнике или сразу в кастрюлю на слабый огонь. Прогреть, влить сливки и довести до горячего, не кипятя."
  },
  "reheating": {
    "methods": [
      {
        "method": "stovetop",
        "instructions": "На слабом огне, помешивая, не доводя до кипения — иначе сливки могут свернуться.",
        "minutes": 7
      },
      {
        "method": "microwave",
        "instructions": "Под крышкой на средней мощности, перемешивая каждую минуту.",
        "minutes": 3
      }
    ],
    "note": "Гренки кладите уже в тарелку, чтобы не размокли."
  }
}
